title,description,content,published_at,source,url
Some Galaxy S25 users start seeing an iPhone-style battery feature pop up,"Samsung's latest flagship series now lets you check battery health, cycle count, and first use date right in the settings.","What you need to know
<ul><li>The Galaxy S25 series introduces a new battery health feature, showing stats like health percentage, cycle count, and device manufacturing details in the settings.</li>… [+2586 chars]",2025-01-24T12:13:25Z,Android Central,https://www.androidcentral.com/phones/some-galaxy-s25-users-start-seeing-an-iphone-style-battery-feature-pop-up
Trump declares U.S. will withdraw from the World Health Organization,The newly inaugurated president has announced his intention to terminate U.S. membership in the U.N.'s global health agency.,"President Trump is making good on his pre-election pledge to withdraw from the World Health Organization. In one of many orders issued after his inauguration, he announced the start of the process fo… [+3132 chars]",2025-01-21T01:51:10Z,NPR,https://www.npr.org/sections/goats-and-soda/2025/01/20/g-s1-42918/trump-world-health-organization-withdrawal
National Institutes of Health cancels scientific meetings after Trump directives,An email obtained by NPR says NIH employees are subject to a travel freeze and offers of employment are being rescinded. Scientists worry about disruptions to critical research.,Scientific researchers around the country are concerned after the National Institutes of Health canceled meetings this week with very little explanation. The move comes after federal health officials… [+5024 chars],2025-01-23T18:40:05Z,NPR,https://www.npr.org/sections/shots-health-news/2025/01/23/nx-s1-5272398/nih-trump-hhs-cancer-research
Federal health agencies told to halt all external communications,"In a memo obtained by NPR, acting health secretary Dorothy Fink forbade staff from public communications on most matters until Feb. 1, unless they get express approval from 'a presidential appointee.'","Employees of the U.S. Department of Health and Human Services were told to halt all public communications Tuesday.
NPR obtained a memo issued by the acting head of HHS, Dorothy Fink, to the heads of… [+3305 chars]",2025-01-22T20:25:34Z,NPR,https://www.npr.org/sections/shots-health-news/2025/01/22/nx-s1-5270866/hhs-cdc-health-communications-trump
Vibration Plates: Do They Actually Help You Lose Weight?,"Vibration plates are all the rage on social media, but do they do anything for your health?","If you're on the fitness side of TikTok, you might have seen videos of influencers touting the benefits of vibration plates. While this may seem like another new social media trend, the concept of vi… [+10087 chars]",2025-01-20T11:23:02Z,CNET,https://www.cnet.com/health/fitness/vibration-plates-do-they-help-you-lose-weight/
"Dentist-Recommended Waterpik Aquarius Water Flosser Is Only $60, the Lowest Price of the Year!",It's way cheaper than the cost of dental treatment.,Looking for a professional-grade teeth cleaning option at a low price? The Waterpik Aquarius Water Flosser is a dentist-recommended device that makes cleaning your teeth much more accessible (and eas… [+2415 chars],2025-01-24T15:45:24Z,Gizmodo.com,https://gizmodo.com/dentist-recommended-waterpik-aquarius-water-flosser-is-only-60-the-lowest-price-of-the-year-2000553794
Fitbit Versa 4 Smartwatch Hits a Yearly Low and It’s Cheaper Than Garmin,"Time to get back on track with getting into shape, and you can do it for less with this Fitbit deal.","The Fitbit Versa 4 is what happens when a fitness tracker and a smartwatch have a really good-looking baby. It’s got all the health and exercise stuff you’d want, plus the smart features that make li… [+2218 chars]",2025-02-10T14:50:55Z,Gizmodo.com,https://gizmodo.com/fitbit-versa-4-smartwatch-hits-a-yearly-low-and-its-cheaper-than-garmin-2000560934
'Doctors called me attention-seeking when I was suicidal',Jessica Matthews was 21 when she was diagnosed with borderline personality disorder.,"Zola Hargreaves
Jessica Matthews says she was mistreated due to having Borderline Personality Disorder.
For some, the diagnosis of a personality disorder can be a route to treatment and understandi… [+6287 chars]",2025-01-27T22:44:36Z,BBC News,https://www.bbc.com/news/articles/c3w8517wd02o
Hundreds of Ducks Found Dead of Suspected Bird Flu Around Chicago,"23 million birds have contracted H5N1 in the U.S. in the past 30 days, according to USDA.","Roughly 200-300 ducks have been found dead in Chicago and the northern suburbs around Lake Michigan in recent days, according to a new report from local news outlet NBC5. The red-breasted mergansers … [+2798 chars]",2025-02-03T19:15:00Z,Gizmodo.com,https://gizmodo.com/hundreds-of-ducks-found-dead-of-suspected-bird-flu-around-lake-michigan-2000558438
'Clear failings' found in NHS care of triple killer,"Valdo Calocane was given a hospital order for killing Ian Coates, Barnaby Webber and Grace O'Malley-Kumar in 2023.","Asha Patel
Valdo Calocane, who was diagnosed with paranoid schizophrenia, was given a hospital order in January 2024 after admitting manslaughter on the basis of diminished responsibility
A major r… [+12696 chars]",2025-02-05T01:23:56Z,BBC News,https://www.bbc.com/news/articles/cg7zexzndvko
IVF pregnancies at greater risk of exposure to medicines that can harm the fetus,A new study has revealed a potential reason why some pregnancies achieved through assisted reproductive technology (ART) may result in birth defects in comparison to naturally conceived pregnancies.,A new Australian study has revealed a potential reason why some pregnancies achieved through assisted reproductive technology (ART) may result in birth defects in comparison to naturally conceived pr… [+4048 chars],2025-01-15T17:57:15Z,Science Daily,https://www.sciencedaily.com/releases/2025/01/250115125715.htm
Samsung is expanding the Galaxy Ring in five important new ways,"New sizes, new countries, and three new health and sleep-tracking features will help flesh out the Galaxy Ring in 2025.","What you need to know
<ul><li>The Samsung Galaxy Ring now comes in sizes 14 and 15 and is available in 53 markets, including 16 new countries.</li><li>Two new sleep tracking features are available i… [+2378 chars]",2025-01-13T14:20:05Z,Android Central,https://www.androidcentral.com/wearables/samsung-is-expanding-the-galaxy-ring-in-five-important-new-ways
Withings ScanWatch 2 review: A good-looking 'smartwatch' and not much else,"This attractive hybrid smartwatch offers reliable health data and decent sleep and fitness tools, along with notifications and excellent battery life.","Hybrid smartwatches feel like a dying race, making the Withings ScanWatch 2 a rare breed. Fossil is no longer in the game after exiting the smartwatch market in 2024. Aside from Garmin's more sporty … [+17962 chars]",2025-01-19T04:00:00Z,Android Central,https://www.androidcentral.com/wearables/withings-scanwatch-2-review
I'm more excited about Samsung's vague AI health plans than the Galaxy S25,"Forget the Galaxy S25 Edge, give me a more comprehensive, AI-backed Samsung Health app for the Galaxy Watch 8 and Ring 2.","Galaxy Unpacked typically spends about 90% of its two-hour runtime on phones, cameras, and AI. This Wednesday, while I photographed the Galaxy S25 Edge and other show-floor demos in San Jose, my mind… [+6531 chars]",2025-01-24T20:00:00Z,Android Central,https://www.androidcentral.com/wearables/im-more-excited-about-galaxy-unpacked-samsung-health-features-than-galaxy-s25
Gutting USAID Will Have a Monumental Effect on Combating Climate Change,The agency was a key player in renewable energy and disaster protection around the world—until Elon Musk showed up.,"This story originally appeared on Grist and is part of the Climate Desk collaboration.
As part of a broad effort to bypass Congress and unilaterally cut government spending, Donald Trumps administra… [+3173 chars]",2025-02-08T12:00:00Z,Wired,https://www.wired.com/story/gutting-usaid-will-have-a-monumental-effect-on-combating-climate-change/
Your Love Life on Ozempic,"Beyond treating diabetes and helping people lose weight, GLP-1s may also improve libido. But the reasons are as complex as desire itself.","When it comes to erectile dysfunction, sleep is often an overlooked factor, says Petar Bajic, director of mens health at the Cleveland Clinics Glickman Urological Institute. Testosterone is made duri… [+3463 chars]",2025-02-12T11:00:00Z,Wired,https://www.wired.com/story/ozempic-glp-1s-libido-love-life/
How Courts Can Stop Trump From Using ICE Raids Against Hospitals,Judges must apply the discretion that the law affords them to act as a bulwark against this erosion of public health.,"Sign up for the Slatest to get the most insightful analysis, criticism, and advice out there, delivered to your inbox daily.
The Trump administrations decision to end long-standing rules barring Imm… [+7618 chars]",2025-01-24T10:45:00Z,Slate Magazine,https://slate.com/news-and-politics/2025/01/courts-can-stop-trump-ice-raids-hospitals.html
4 takeaways after RFK Jr. is grilled by senators during confirmation hearing,The takeaways after Robert F. Kennedy Jr. faced questions from senators during his confirmation hearing to potentially lead the Department of Health and Human Services.,"In the first of two public sit-downs with the Senate that will decide his possible future as secretary of the Department of Health and Human Services, Robert F. Kennedy Jr. faced nearly four hours of… [+9048 chars]",2025-01-29T23:54:29Z,ABC News,https://abcnews.go.com/Politics/4-takeaways-rfk-jr-senate-hearing/story?id=118213176
From Covid to Norovirus: Moderna’s mRNA Tech Takes on Stomach Flu,"Moderna's Phase III trial will test out its experimental vaccine in 25,000 people over the next two years.","The misery of the common stomach flu may be coming to an end. Pharmaceutical company Moderna has launched a large-scale Phase III trial that will test out a vaccine against norovirus, a frequent and … [+4384 chars]",2025-01-20T11:00:30Z,Gizmodo.com,https://gizmodo.com/from-covid-to-norovirus-modernas-mrna-tech-takes-on-stomach-flu-2000550591
"Protesters, McDonald's and onesies - RFK Jr's confirmation hearing",A number of senators grilled the controversial nominee over his views on vaccines and abortion.,"President Donald Trump's US health secretary pick, Robert F Kennedy Jr, faced hours of grilling from a committee of senators ahead of his confirmation vote.
A number of senators grilled the nominee … [+89 chars]",2025-01-29T19:03:49Z,BBC News,https://www.bbc.com/news/videos/cz9e1vvpq72o
USAID officials direct staff on 'stunning and irresponsible' cuts to jobs and offices,Secretary of State Marco Rubio approved less than 300 essential personnel as USAID staff in the U.S. and overseas rush to rapidly close missions and leave jobs by midnight Friday.,"Amid global fallout over the blockage in funding and staffing for the United States Agency for International Aid, senior staff submitted a list to State Department leadership of around 600 people who… [+3594 chars]",2025-02-06T22:29:51Z,NPR,https://www.npr.org/2025/02/06/g-s1-46885/usaid-cuts-state-department-trump-rubio
Judge Ends One Man's 11-Year Quest to Recover $765 Million in Bitcoin by Digging Up a Landfill,"A UK judge ruled against James Howells, who has been trying to get a hard drive with private keys to a cryptocurrency fortune out of a landfill for over a decade.","A British judge ruled against a man who wants to excavate a landfill where he says a hard drive with access to thousands of bitcoins was mistakenly dumped over 11 years ago.
Since 2013, James Howell… [+3646 chars]",2025-01-13T20:25:06Z,Wired,https://www.wired.com/story/bitcoin-landfill-excavation-james-howells-judge-ruling/
Is one drink a day OK? Here's what to consider,"On the heels of the Surgeon General's warning about the cancer risks of alcohol, there's growing consensus that less is better. But how much is enough? Here's what the experts recommend.","On the heels of the Surgeon General's warning about the cancer risks of alcohol, there's a growing consensus that less is better.
But this doesn't mean that people who choose to drink should give it… [+6527 chars]",2025-01-13T10:00:00Z,NPR,https://www.npr.org/sections/shots-health-news/2025/01/13/nx-s1-5251649/cancer-alcohol-wine-beer-surgeon-general
How 15 months of war has devastated Gaza,"BBC Verify examines how fighting has impacted civilians lives in Gaza, after over a year of fighting.","A ceasefire deal to bring an end to the 15-month long conflict between Israel and Hamas has been finalised in Qatar.
Israel has long said it would not agree to any ceasefire until it completed milit… [+7291 chars]",2025-01-16T17:44:45Z,BBC News,https://www.bbc.com/news/articles/czx8de2k4epo
What question stumped a Trump cabinet pick? Find out in the news quiz!,"If you've paid attention to the coming inauguration, TikTok drama and the Princess of Wales' health, you'll do pretty well this week.","This week featured contentious confirmation hearings, which caused the news media to inadvertently alliterate over and over. (""Contentious confirmation"" is also an example of assonance. Thank you, hi… [+106 chars]",2025-01-17T10:00:00Z,NPR,https://www.npr.org/2025/01/17/g-s1-42395/inauguration-pete-hegseth-rednote-tiktok-princess-kate
"LA Times owner boosts RFK Jr. online, as writer says paper cut his critique",Los Angeles Times owner Patrick Soon-Shiong has become a fierce champion online for Robert F. Kennedy Jr.'s nomination for U.S. Secretary of Health and Human Services.,"Los Angeles Times owner Dr. Patrick Soon-Shiong, a billionaire medical inventor, says it's ""cynical"" to believe his support of Robert F. Kennedy Jr. or his decision to kill a planned endorsement of t… [+10267 chars]",2025-02-03T10:00:00Z,NPR,https://www.npr.org/2025/02/03/nx-s1-5251508/la-times-owner-soon-shiong-rfk-jr-opinion-op-ed
U.S. pays $590 million to Moderna to speed up development of bird flu vaccine,"The public health risk remains low, but bird flu variants have proven to be unpredictable, which is why the virus is a top priority for the federal government.","The U.S. Department of Health and Human Services announced it will award $590 million to Moderna to accelerate the development of influenza vaccines, including to protect against bird flu. 
""Acceler… [+1480 chars]",2025-01-18T20:06:25Z,NPR,https://www.npr.org/2025/01/18/nx-s1-5266868/bird-flu-vaccine-moderna
"Trump's health secretary pick, Robert F. Kennedy Jr., faces confirmation hearing","Robert F. Kennedy Jr., President Trump's nominee to lead the Department of Health and Human Services, faces Senate confirmation hearings today. What can we expect?","We're following the confirmation hearings for the incoming Trump administration. See our full politics coverage, and follow NPR's Trump's Terms podcast or sign up for our Politics newsletter to stay … [+1174 chars]",2025-01-29T09:23:28Z,NPR,https://www.npr.org/2025/01/28/nx-s1-5272727/trump-cabinet-picks-rfk-confirmation-hearing
Effective immediately: CDC can't talk to WHO. What will that mean for world health?,Staff at the Centers for Disease Control and Prevention have been told to halt all communication with the World Health Organization.,"This week, as officials at World Health Organizations convene meetings discussing everything from Marburg virus in Tanzania to mpox in the Democratic Republic of Congo, there are some empty seats in … [+6197 chars]",2025-01-29T19:38:49Z,NPR,https://www.npr.org/sections/goats-and-soda/2025/01/29/nx-s1-5276340/trump-centers-for-disease-control-cdc-world-health-organization
6 ways rich Gen Zers are splashing out and redefining luxury for themselves,"From antiaging treatments to lavish health-focused vacations, rich Gen Zers are spending on luxury brands and experiences that align with their values.","Gen Zers are defining wealth differently from older generations.Matt Winkelmeyer/Getty Images
<ul><li>The richest Gen Zers are confident about being able to build up wealth.</li><li>When it comes to… [+7027 chars]",2025-02-02T11:03:01Z,Business Insider,https://www.businessinsider.com/rich-gen-z-redefining-luxury-wealth-travel-clothing-food-scents-2025-2
I want to lose weight. A dietitian said to eat more carbs.,"It's a myth that carbs make us gain weight more than other macronutrients. In fact, they provide energy and can boost our health in a variety of ways.","Sweet potatoes are a great source of carbohydrates.DronG/Getty Images
<ul><li>Jeffrey, 57, submitted an average day of eating to be reviewed for Business Insider's Nutrition Clinic.</li><li>A dietit… [+4541 chars]",2025-01-15T08:29:02Z,Business Insider,https://www.businessinsider.com/eat-more-carbs-lose-weight-sustainably-dietitian-advice-2025-1
The New Temperance Is All About Health,How sobriety went from a radical social movement to a tool of self-optimization,"In 1900, a former schoolteacher named Carrie Nation walked into a bar in Kiowa, Kansas, proclaimed, Men, I have come to save you from a drunkards fate, and proceeded to hurl bricks and stones at bott… [+7537 chars]",2025-01-13T12:30:00Z,The Atlantic,https://www.theatlantic.com/health/archive/2025/01/alcohol-surgeon-general-sober-curious-temperance/681283/
Meet the people curbing their consumerism and needless spending with a 'low-buy year',"The ""low-buy year"" trend reflects some consumers' desire to curb spending, reduce debt, and prioritize financial health over conspicuous consumption.","Some consumers are trying to make far fewer purchases this year.Malte Mueller/Getty Images
<ul><li>Some people are embracing ""low-buy year"" to curb their consumerism and slash their debt.</li><li>Af… [+7265 chars]",2025-01-26T11:07:01Z,Business Insider,https://www.businessinsider.com/low-buy-year-reduce-consumption-needless-spending-saving-fast-fashion-2025-1
I've been doing yoga for 25 years. Here are 7 things I wish I knew when I started.,"After practicing yoga for 25 years, I know much more about the mental-health benefits than when I started. I've also learned new varieties and poses.","I wish I'd known a few tips and lessons when I started doing yoga 25 years ago.Trisha Daab
<ul><li>I've been doing yoga for 25 years, and in that time, I've learned a lot about the practice.</li><li… [+5268 chars]",2025-02-06T12:48:01Z,Business Insider,https://www.businessinsider.com/best-yoga-tips-longtime-yogi-things-wish-i-knew-2025-2
Apple Highlights Hearing Health Issues Leading Up to Super Bowl LIX,"Apple and the University of Michigan have released new results from the Apple Hearing Study highlighting the increase in noise levels seen around recent Super Bowl games. The results come just ahead of Super Bowl LIX taking place in New Orleans on Sunday, Feb…",Apple and the University of Michigan have released new results from the Apple Hearing Study highlighting the increase in noise levels seen around recent Super Bowl games. The results come just ahead … [+1211 chars],2025-01-30T16:04:15Z,MacRumors,https://www.macrumors.com/2025/01/30/apple-hearing-study-super-bowl/
How to Access Important Health Info That's Been Scrubbed From the CDC Site,"The Trump administration removed pages relating to LGBTQ issues, HIV information, racial disparities and more, but you can still find them on the Wayback Machine.","The Centers for Disease Control and other government websites began complying with President Donald Trump's executive orders on Jan. 31, removing dozens of webpages concerning LGBTQ health, HIV infor… [+2871 chars]",2025-02-04T22:16:35Z,CNET,https://www.cnet.com/tech/services-and-software/how-to-access-important-health-info-thats-been-scrubbed-from-the-cdc-site/
"The Oura Ring is about giving your body a voice, says Oura CEO","The Oura Ring 4 set a standard in the smart ring industry, and its CEO is excited for the future to make Oura the ring connected to our health.","(Image credit: Android Central)
Off the Record is a weekly column written by Android Central's editor-in-chief. The column looks to expand and go in-depth on topics in the Android space without any … [+5987 chars]",2025-01-16T13:00:00Z,Android Central,https://www.androidcentral.com/wearables/oura-ring-ceo-tom-hale-interview
'I feel blessed to get weight-loss jab' - but can the NHS afford it for all?,"We meet some of the first NHS patients, as expert says funding everyone eligible would ""bankrupt"" the service.","Ray says he feels ""lucky"" to have had access to the drug via the NHS, especially now he is a granddad to Willow
Ray, 62 from south London, became one of the first patients to receive the weight-loss… [+9904 chars]",2025-01-13T06:16:24Z,BBC News,https://www.bbc.com/news/articles/clyn92j4nn2o
Kate photographed by Prince Louis to mark World Cancer Day,The Princess of Wales is showing her support for cancer patients with a photo taken by her six-year-old son.,"A photograph of the Princess of Wales taken by her six-year-old son Prince Louis has been released to mark World Cancer Day on Tuesday.
The image shows Catherine in a frosty woodland scene, arms ope… [+1283 chars]",2025-02-03T17:25:40Z,BBC News,https://www.bbc.com/news/articles/c805jgk3vj1o
Bird flu prevention zone to cover whole of England,"The order, in place from midday on Saturday, comes as cases of bird flu are on the rise.","A bird flu prevention zone enforcing strict strict hygiene standards around birds is being declared for the whole of England from noon on Saturday.
The rising number of cases and the risk to wildlif… [+1694 chars]",2025-01-25T11:41:20Z,BBC News,https://www.bbc.com/news/articles/cly9r71pn91o
Lifeguards found not guilty over death of swimmer,Christopher Rogers died during a swimming session at the Orchard Leisure Centre in Armagh in 2017.,"A jury has found three lifeguards not guilty of failing to take ""reasonable care for the health and safety of others"" on the night Armagh swimmer Christopher Rogers died.
Mr Rogers, 20, passed away … [+1426 chars]",2025-01-28T15:53:45Z,BBC News,https://www.bbc.com/news/articles/cp9x8dxkzkro
"Treat eating disorders as an emergency, MPs urge","The alarming rise in disorders such as anorexia and bulimia is now an emergency, a cross-party group says.","Olimata felt like ""a shell of a human"", when she had anorexia, as a teenager
Lives are being lost and families torn apart because of ""woefully inadequate care"" for people with eating disorders, acco… [+5440 chars]",2025-01-22T00:55:46Z,BBC News,https://www.bbc.com/news/articles/c897g3d748zo
The Supreme Court’s Trans Health Case Shows Why Patients Should Make the Decisions,Supreme Court arguments over trans health care makes plain how badly we need personalized health care in all of medicine,Since 2021 a legal tug-of-war over state bans on health care for transgender youth has wound through U.S. courts. Many judges ruled that bans discriminate against a group of people who should enjoy c… [+7708 chars],2025-01-16T12:00:00Z,Scientific American,https://www.scientificamerican.com/article/the-supreme-courts-trans-health-case-shows-why-patients-should-make-the/
Watch: Gaza ceasefire and hostage deal announced,A ceasefire deal between Israel and Hamas is announced by Qatar's prime minister.,"A ceasefire deal between Israel and Hamas has been announced by Qatar Prime Minister Mohammed bin Abdulrahman bin Jassim bin Jabr Al Thani . 
Israel and Hamas have held on-off indirect talks for a c… [+400 chars]",2025-01-15T19:10:35Z,BBC News,https://www.bbc.com/news/videos/cly7n19w70xo
Chernobyl’s Stray Dogs Are Genetically Distinct—But Radiation Isn’t the Reason,Dogs living near the Chernobyl nuclear plant aren’t radioactive mutants—but their genetic differences reveal a surprising story.,"In 1986, the Chernobyl nuclear reactor in the Soviet Union, now in Ukraine, exploded, spewing massive amounts of radioactive material into the environment. Almost four decades later, the stray dogs t… [+4243 chars]",2025-01-15T20:55:17Z,Gizmodo.com,https://gizmodo.com/chernobyls-stray-dogs-are-genetically-distinct-but-radiation-isnt-the-reason-2000550665
"Researchers find improved method for treating rare, aggressive, pregnancy-related cancer","A new drug delivery system shows promise for treating a rare, aggressive form of cancer affecting pregnant women and new mothers, and it has potential with other cancers as well.","A new drug delivery system shows promise for treating a rare, aggressive form of cancer affecting pregnant women and new mothers, and it has potential with other cancers as well.Scientists led by Ole… [+3795 chars]",2025-02-06T03:40:33Z,Science Daily,https://www.sciencedaily.com/releases/2025/02/250205224033.htm
Feds Finally Ban Controversial Food Dye,"Say farewell to Red No. 3, a dye linked to thyroid cancer in rats and hyperactivity in children.","Red is often used to make foods and medicines look more vibrant. Trouble is, a widely used red food dye has been linked to serious health risksbut its days now appear to be at an end.
A synthetic fo… [+3795 chars]",2025-01-15T16:35:09Z,Gizmodo.com,https://gizmodo.com/feds-finally-ban-controversial-food-dye-2000550484
Brain Monitoring Could Be the Dystopian Future of Work,"Advocates say neurotechnology can encourage economic growth and the betterment of society. Others say it could fuel inequity and undermine democracy, among other possible unknown consequences.","Despite all the attention on technologies that reduce the hands-on role of humans at work such as self-driving vehicles, robot workers, artificial intelligence and so on researchers in the field of n… [+5895 chars]",2025-01-30T12:00:04Z,Gizmodo.com,https://gizmodo.com/brain-monitoring-could-be-the-dystopian-future-of-work-2000556691
