title,description,content,published_at,source,url
"My Son's Birth Was Nearly Perfect, But Days Later I Almost Died. These Are The Symptoms You Should Never Ignore.","""I picked up my phone 10 minutes later to two missed calls and a voicemail from my OBGYN telling me to go to the hospital immediately.""","Our second night home from the hospital was still an awe-inspiring flurry of excitement. My husband and I were snuggled in bed with our perfectly healthy newborn baby boy, who was fast asleep on my c… [+13605 chars]",2025-01-20T02:31:02Z,Buzzfeed,https://www.buzzfeed.com/christinamcdowell/postpartum-preeclampsia-symptoms
Women seeking abortions after using 'natural' contraception,"Researchers have seen a shift from ""more reliable"" hormonal contraceptives to fertility tracking apps.","There has been a rise in the proportion of women seeking abortions despite using ""natural"" methods to prevent pregnancy, like fertility tracking apps, a study in England and Wales suggests.
The data… [+4205 chars]",2025-01-14T00:57:33Z,BBC News,https://www.bbc.com/news/articles/c391nlxrv4vo
"My husband is a teacher and the sole earner for our family of 7. Money is tight, but it's worth it for his health insurance.",We have five kids and my husband has reached the maximum salary as a teacher. It's still worth it because of the excellent health insurance we get.,"The author's husband (not pictured) still works as a teacher for health insurance.Solskin/Getty Images
<ul><li>My husband has been teaching for 20 years. </li><li>His salary is $19,000 above the pov… [+3606 chars]",2025-01-13T18:04:02Z,Business Insider,https://www.businessinsider.com/my-husband-is-a-teacher-the-salary-is-not-great-but-health-insurance-is-2025-1
Trump’s Plan to Leave the WHO Is a Health Disaster,"The exit will cut a huge chunk from the World Health Organization’s budget, but the short-term financial gain for the US could come at the cost of disease outbreaks flaring up across the world.","In the summer of 2020, 15 recognized leaders in US public health gathered to author an article in The Lancetone of the worlds most eminent medical journalsdecrying Donald Trumps intention to withdraw… [+3060 chars]",2025-01-22T00:14:05Z,Wired,https://www.wired.com/story/trump-plan-to-leave-the-who-health-disaster/
Born too late? Climate change may be delaying births,"New research has found exposure to outdoor air pollution and extreme temperatures during pregnancy may increase the risk of prolonged pregnancy, offering new insights into the impact of climate change on maternal health.","New Curtin University research has found exposure to outdoor air pollution and extreme temperatures during pregnancy may increase the risk of prolonged pregnancy, offering new insights into the impac… [+2476 chars]",2025-02-11T04:18:15Z,Science Daily,https://www.sciencedaily.com/releases/2025/02/250210231815.htm
Former Little Mix singer Jesy Nelson pregnant,"The singer, 33, posted a photo on Instagram with the caption: ""She's eating for 3 now"".","Former Little Mix star Jesy Nelson has announced her pregnancy.
The singer, 33, posted a photo on Instagram with the caption: ""She's eating for 3 now,"" and two baby emojis.
She was pictured alongsi… [+895 chars]",2025-01-12T18:28:35Z,BBC News,https://www.bbc.com/news/articles/c7vd6q36ppro
Teen Mental Health App Sent Kids’ Data Straight to TikTok,"The company removed tracking tools from its teen-focused websites in New York, Seattle, and Baltimore after parents complained.","A telehealth company that New York City paid $26 million to provide free online therapy to teens was leaking data about who visited the website to TikTok, Meta, Snap, and other social media companies… [+7486 chars]",2025-02-04T15:45:47Z,Gizmodo.com,https://gizmodo.com/teen-mental-health-app-sent-kids-data-straight-to-tiktok-2000557615
How will Trump's return to the White House change the face of global health?,"When Donald Trump returns to the White House, he's expected to issue a series of orders with far-reaching impact on global health — from abortion services to support for the World Health Organization.","Donald Trump is just days away from the beginning of his second presidential term. His return to power has the potential to dramatically reshape the global health landscape.
Right now, the U.S. is t… [+17829 chars]",2025-01-17T12:59:42Z,NPR,https://www.npr.org/sections/goats-and-soda/2025/01/17/g-s1-42907/trump-world-health-organization-abortion-rights-pepfar-pandemic
The Fitbit Inspire 3 at Its All-Time Low Price Makes the Perfect Gift for Your Fitness-Focused Valentine,"Save 20% on the Fitbit Inspire 3 health and fitness-tracker at Amazon, just in time for Valentine's Day.","Looking for a gift for you fitness-focused Valentine? Find something that tells your partner you love them, whether they are a runner, rock climber, or regular gym goer. As part of a limited time dea… [+2144 chars]",2025-02-04T16:20:21Z,Gizmodo.com,https://gizmodo.com/the-fitbit-inspire-3-at-its-all-time-low-price-makes-the-perfect-gift-for-your-fitness-focused-valentine-2000558623
Swinney announces plan to bring down NHS waits,"The first minister says the health service will deliver an extra 150,000 appointments and procedures.","Angus Cochrane
John Swinney says his government will harness new technologies to bring down waiting times 
NHS Scotland will deliver an extra 150,000 appointments and procedures in the coming year,… [+5505 chars]",2025-01-27T12:49:02Z,BBC News,https://www.bbc.com/news/articles/crr0jdz8z7no
RFK Jr. Wins Crucial Senate Vote to Lead America’s Health System,"Kennedy has had a long track record of making misleading or outright false statements about important health issues, particularly on vaccination.","Robert F. Kennedy Jr. is now one crucial step closer to governing America’s public health. On Tuesday morning, the U.S. Senate Finance Committee gave its blessing to President Trump’s nomination of R… [+2565 chars]",2025-02-04T15:56:49Z,Gizmodo.com,https://gizmodo.com/rfk-jr-wins-crucial-senate-vote-to-lead-americas-health-system-2000558959
Al Fayed claimed 'poor health' when police investigated abuse,Pelham Spong reported to police in 2017 that Mohammed Al Fayed had assaulted her a decade before but the investigation was shut down.,"Pelham Spong applied for a job as a PA to Al Fayed in 2008 while she was living in Paris
The Metropolitan Police failed to challenge a claim from Mohamed Al Fayed that he was too ill to respond to a… [+6305 chars]",2025-01-18T00:43:22Z,BBC News,https://www.bbc.com/news/articles/cqldd2xpvy5o
'Filming me sleep on ward made my mental health worse',Former mental health patients are worried camera surveillance is being used without explicit consent.,"Nell, Hat and Sophina are concerned about camera monitoring, but Oxehealth say they have ""been proven to help clinical teams enhance safety""
CCTV and cameras are not uncommon on mental health wards,… [+6854 chars]",2025-01-22T06:22:44Z,BBC News,https://www.bbc.com/news/articles/cq8kqzgel2no
Trump orders US to leave World Health Organization,Trump has long been critical of how the Geneva-based institution handled the Covid-19 pandemic.,"US President Donald Trump has signed an executive order to begin the process of withdrawing the US from the World Health Organization (WHO).
""Oooh, that's a big one,"" the newly inaugurated US presid… [+452 chars]",2025-01-21T02:11:36Z,BBC News,https://www.bbc.com/news/articles/c391j738rm3o
Five takeaways from RFK Jr's first confirmation hearing,"Senators grilled Robert F Kennedy Jr, Trump's pick for health secretary, on vaccine comments and his stance on abortion.","Nadine Yousif and Mike Wendling
Watch: Protesters, McDonald's and onesies - RFK Jr's confirmation hearing
President Donald Trump's pick for US health secretary, Robert F Kennedy Jr, was questioned … [+6927 chars]",2025-01-29T20:16:40Z,BBC News,https://www.bbc.com/news/articles/c74mj39dkklo
Streeting accuses Farage of 'miserabilist' vision for UK,"The health secretary says Reform UK has a ""poverty of ambition"" for the UK that Labour ""utterly rejects"".","The health secretary has accused Reform UK leader Nigel Farage of having a ""miserablist, declinist"" vision of the UK, in the most direct attack yet by a senior Labour figure. 
Wes Streeting made the… [+3142 chars]",2025-01-25T17:57:28Z,BBC News,https://www.bbc.com/news/articles/cwyp548gj8vo
"Bereaved maternity families' treatment shocking, says Streeting","Health secretary responds to bereaved parents in Leeds, following investigation showing 56 deaths at NHS trust may have been preventable.","Streeting said he wanted to ensure 'there are no repeats of these unimaginable tragedies'.
Wes Streeting has praised bereaved parents in Leeds who have called for an urgent review into maternity saf… [+3131 chars]",2025-01-17T18:55:23Z,BBC News,https://www.bbc.com/news/articles/clynngkny8ko
Campaigner launches bid to ban cross-sex hormones for under-18s,Lawyers write to health secretary warning him to take action or they will seek a judicial review.,"Health Secretary Wes Streeting is being threatened with legal action if he does not ban the private sale of cross-sex hormones such as testosterone to under 18s. 
Lawyers acting for three people - i… [+4157 chars]",2025-01-31T16:52:27Z,BBC News,https://www.bbc.com/news/articles/cn4md23dgg2o
Navigate Maternity Offers Hope For The Maternal Health Crisis,"Remote maternal monitoring during and after pregnancy allows early detection of complications like preeclampsia, improving care for mothers and babies.","Navigate Maternity leadership team left to right: Ariana McGee, founder and CEO; Dr. Elicia Harris, ... [+] MBA cofounder and chief medical officer, and Theadora James, MHA, cofounder and COO.
Navig… [+8030 chars]",2025-02-12T12:00:00Z,Forbes,https://www.forbes.com/sites/geristengel/2025/02/12/navigate-maternity-offers-hope-for-the-maternal-health-crisis/
Digital 1.28: The global reach of HHS,"As confirmation hearings begin for RFK Jr. as secretary of HHS, many are focused on domestic agenda. But HHS has a vast global scope as well. We interviewed past secretaries Donna Shalala and Alex Azar as well as experts on global health to indicate the range…","With 80,000 employees
 and a $1.8 trillion budget
, the U.S. Department of Health and Human Services (HHS) is a federal behemoth focused on
 improving the health and well-being of all Americans.
… [+10433 chars]",2025-01-28T12:36:57Z,NPR,https://www.npr.org/sections/goats-and-soda/2025/01/28/nx-s1-5276171/rfk-jr-hearings-hhs-health-human-services-secretary
Farm worker contracts human case of bird flu,The UK Health Security Agency says cases of bird-to-human transmission were rare.,"David Gregory-KumarCorrespondent for science, environment &amp; rural affairs
At the site of the Shropshire farm outbreak, the killing and disposal of a million egg-laying birds continues
A person … [+3004 chars]",2025-01-27T16:32:11Z,BBC News,https://www.bbc.com/news/articles/cn01xjp0yq4o
Three councillors quit over Labour WhatsApp scandal,Their depatures come after Labour health minister Andrew Gwynne was sacked by Keir Starmer.,"Three Labour councillors have resigned after being caught up in a scandal over leaked WhatsApp chats.
Health minister Andrew Gwynne was sacked after a newspaper revealed he sent a string of offensiv… [+1470 chars]",2025-02-10T14:26:42Z,BBC News,https://www.bbc.com/news/articles/c9w50dx89w0o
'I've been waiting over a year for a wheelchair',Rob Taylor says the long wait for a custom wheelchair is damaging his mental health.,"Heidi Booth
Mr Taylor says the delay is affecting his mental health
""I've been waiting so long, it is affecting my mental health - it feels as if I'm just stuck and relying on everybody else.""
Rob… [+3168 chars]",2025-02-10T06:25:03Z,BBC News,https://www.bbc.com/news/articles/cpqlplpd4dxo
Are You Pooping Enough to Be Considered Healthy?,"This is what your pooping schedule says about your overall health, according to experts.","Talking about poop can be embarrassing. If you think something is ""off"" with your routine, you may not feel comfortable comparing your schedule for number two with friends. Yet, how often we poop, ho… [+8714 chars]",2025-02-04T13:11:03Z,CNET,https://www.cnet.com/health/medical/are-you-pooping-enough-to-be-considered-healthy/
Preventive Mental Health Care for Postpartum Depression,"Postpartum depression affects many new mothers, increasing suicide risk. New research shows preventive cognitive behavioral therapy is effective in reducing rates of occurrence.","This article was co-authored by Nikita Baxi and Robert Muller, PhD.
Postpartum depression is a form of clinical depression that affects 10 to 20 percent of women after childbirth. Recent data from 2… [+4894 chars]",2025-01-25T20:03:30Z,Psychology Today,https://www.psychologytoday.com/intl/blog/talking-about-trauma/202411/preventive-mental-health-care-for-postpartum-depression
"Tips for Navigating Postpartum Mental Health, From Experts","It's time to stop treating postpartum depression as ""just something to expect.""","By Hannah FryeHannah Frye is the Beauty &amp; Health Editor at mindbodygreen. She has a B.S. in journalism and a minor in womens, gender, and queer studies from California Polytechnic State Universit… [+12428 chars]",2025-01-22T11:05:00Z,mindbodygreen.com,https://www.mindbodygreen.com/articles/postpartum-depression-treatment-is-herewhat-about-prevention
US Covid adviser Fauci has his security protection revoked by president,The former top US health official has faced death threats since leading  the country's COVID-19 response.,"President Donald Trump has revoked security protection for former top US health official Anthony Fauci, who has faced death threats since leading the country's Covid-19 response. 
 ""You can't have a… [+2436 chars]",2025-01-24T19:07:52Z,BBC News,https://www.bbc.com/news/articles/cvg49jz7v8no
Excess weight gain in first trimester associated with fetal fat accumulation,"Fetuses of pregnant people who gained excess weight in the first trimester of pregnancy show signs of excess fat distribution in the upper arm and in the abdomen, according to a new study. These findings may inform efforts to prevent excessive weight gain ear…","Fetuses of pregnant people who gained excess weight in the first trimester of pregnancy show signs of excess fat distribution in the upper arm and in the abdomen, according to a study by researchers … [+1670 chars]",2025-01-17T16:20:33Z,Science Daily,https://www.sciencedaily.com/releases/2025/01/250117112033.htm
Trump’s Choose-Your-Own-Adventure Health Agenda Is a Wake-Up Call for Cities and States,Former NYC Health Commissioner Dr. Ashwin Vasan explores what Trump’s nominations of RFK Jr. and David Weldon mean for health policy in cities and states.,Donald Trump has taken office with a view on health policy that has left many in the medical field concerned. Despite the rhetoric that his team will take on long-entrenched issues of nutrition and d… [+8116 chars],2025-01-29T12:00:00Z,Time,https://time.com/7210584/trump-health-policies-cities-states-fight-back/
It took me 10 years to feel sexy again after giving birth. A new man and back injury helped me get there.,My partner's unwavering attraction to me was the first part of my journey to accepting my new body. New health issues changed the way I felt for good.,"It took me years to realize my body's abilities are more important than its appearance.Courtesy of Ashley Archambault
<ul><li>I struggled with my post-baby body image, even though I lost much of the… [+4580 chars]",2025-02-06T23:02:01Z,Business Insider,https://www.businessinsider.com/accept-post-baby-body-weight-loss-new-perspective-2025-2
Whitmer signs bills allowing Michigan pharmacists to prescribe birth control,"Bills to expand reproductive rights in Michigan, including a bill that allows pharmacists to directly prescribe and dispense contraceptives to patients, were...","Gov. Gretchen Whitmer sits for a roundtable discussion on reproductive rights in Grand Rapids, Michigan with Vice President Kamala Harris on Feb. 22, 2024. (Photo: Anna Liz Nichols)
Bills to expand … [+6740 chars]",2025-01-22T14:10:49Z,Michiganadvance.com,https://michiganadvance.com/2025/01/22/whitmer-signs-bills-allowing-michigan-pharmacists-to-prescribe-birth-control/
Literally Everything You Need to Know About Fluoride in Our Drinking Water,"Water fluoridation is still up for debate in the US. According to experts, here are the facts.","In November 2024, President Donald Trump nominated Robert F. Kennedy Jr. to lead the US Department of Health and Human Services. He just had his confirmation hearing. Known for his anti-vaccine and a… [+30656 chars]",2025-02-04T12:28:04Z,CNET,https://www.cnet.com/health/medical/literally-everything-need-know-about-fluoride-in-drinking-water/
Why Employers Should Think About Offering Doula Benefits,"With the rise of maternal healthcare disparities, organizations should consider providing employees with access to inclusive doula services.","Cynthia McEwen is the VP of People and Head of DE&amp;I at women's health benefits company Progyny.
getty
Across the last two decades, America has been experiencing a notable maternal health crisis… [+6729 chars]",2025-01-14T12:00:00Z,Forbes,https://www.forbes.com/councils/forbeshumanresourcescouncil/2025/01/14/why-employers-should-think-about-offering-doula-benefits/
"Apple Announces New Health Study Involving the iPhone, Apple Watch, and AirPods","A new Apple Health Study is launching today in the Apple Research app. Apple says U.S. residents can participate in the study if they meet the minimum age requirements, and complete the informed consent process.





The new Apple Health Study aims to further…","A new comprehensive Apple Health Study is launching today in the Apple Research app. Apple says U.S. residents can participate in the study if they meet the minimum age requirements, and complete the… [+1179 chars]",2025-02-12T14:13:56Z,MacRumors,https://www.macrumors.com/2025/02/12/apple-health-study/
Want to Lower Your Stroke Risk? A Little Flossing Might Help,New research finds that regular flossing is linked to a lower risk of clot-related strokes.,"A little flossing may go a long way for your cardiovascular health. Recent research suggests that daily flossing can noticeably reduce people’s risk from stroke.
Scientists at the University of Sout… [+3436 chars]",2025-02-07T21:15:27Z,Gizmodo.com,https://gizmodo.com/want-to-lower-your-stroke-risk-a-little-flossing-might-help-2000561116
"‘Five babies in incubator’: HRW on danger to pregnant women, babies in Gaza","Human Rights Watch finds Israel has violated rights of pregnant women and girls, with no end in sight.","Israels 15-month war on Gaza, as well as severe restrictions it imposed on the flow of humanitarian aid and Israeli forces attacks on health facilities and targeting of healthcare workers, have led t… [+5109 chars]",2025-01-28T05:38:12Z,Al Jazeera English,https://www.aljazeera.com/news/2025/1/28/five-babies-in-incubator-hrw-on-danger-to-pregnant-women-babies-in-gaza
RFK Jr. Made a Million Dollars From His Anti-Vax Work That He Previously Claimed Was ‘Unpaid’,Kennedy has had to make financial disclosures as part of his congressional vetting process.,President-elect Donald Trump is currently trying to get his cabinet nominations approved and that includes one of his most controversial picks: Robert F. Kennedy Jr. RFK has been selected to run the … [+3149 chars],2025-01-15T20:35:03Z,Gizmodo.com,https://gizmodo.com/rfk-jr-made-a-million-dollars-from-his-anti-vax-work-that-he-previously-claimed-was-unpaid-2000550692
Detection of hazardous chemicals in human placenta with unprecedented speed and precision,Scientists have demonstrated a new method for detecting the presence of dangerous chemicals from tobacco smoke in human placenta with unprecedented speed and precision.,Rice University scientists and collaborators at Baylor College of Medicine (BCM) have demonstrated a new method for detecting the presence of dangerous chemicals from tobacco smoke in human placenta … [+5723 chars],2025-02-10T20:39:29Z,Science Daily,https://www.sciencedaily.com/releases/2025/02/250210153929.htm
Bernie Sanders to RFK Jr.: Do You Recognize This Anti-Vaxxer Baby Onesie?,It was just one of many questions that Kennedy seemed unprepared to answer during his Senate confirmation hearing.,"Robert F. Kennedy Jr., Donald Trump’s nominee to head the U.S. Department of Health and Human Services, has vowed to solve America’s “chronic health epidemic,” and, in so doing, “Make America Healthy… [+5864 chars]",2025-01-29T22:05:38Z,Gizmodo.com,https://gizmodo.com/bernie-sanders-to-rfk-jr-do-you-recognize-this-anti-vaxxer-baby-onesie-2000556438
Donald Trump says he stopped $50 million for condoms going to Gaza. Is it true?,The U.S. has spent millions of dollars to send contraceptives to other countries. Did Trump's White House really stop $50 million in condoms for Gaza?,"WASHINGTON It was an astounding revelation, one that Donald Trumps White House was eager to share with the American public.
The Trump administration, eager to stop wasteful government spending, halt… [+5331 chars]",2025-02-01T10:10:23Z,USA Today,https://www.usatoday.com/story/news/politics/2025/02/01/donald-trump-condoms-gaza/78090736007/
A Ring for Valentine’s Day? How About the Samsung Galaxy Ring for Just $150?,"Get up to $250 of trade-in credit toward Samsung's great fitness wearable and another $80 credit toward a new Galaxy Phone, Watch, or Buds.","What better way to celebrate Valentine’s Day than with a brand-new ring? No, the Samsung Galaxy Ring doesn’t contain any diamonds, but it’s a great way to demonstrate your commitment to fitness and b… [+2351 chars]",2025-01-29T15:20:39Z,Gizmodo.com,https://gizmodo.com/a-ring-for-valentines-day-how-about-the-samsung-galaxy-ring-for-just-150-2000556147
OnePlus' new health lab is a big step for its wellness technology,"OnePlus debuts a new health lab in China, doubling down on next-gen wellness tech.","What you need to know
<ul><li>OnePlus has opened a massive 4,840m² Health Lab in Guangdong, China, built to push the limits of wellness innovation.</li><li>The lab is stacked with high-end gear, fro… [+2354 chars]",2025-02-09T15:39:55Z,Android Central,https://www.androidcentral.com/wearables/oneplus-new-health-lab-is-a-big-step-for-its-wellness-technology
"Remembering Margarethe Hilferding, the First Woman Admitted to Freud’s Vienna Psychoanalytic Society","Margarethe Hilferding was the first woman admitted to Sigmund Freud’s Vienna Psychoanalytic Society, but her radical work on maternal instinct was dismissed and ignored","In honor of International Holocaust Remembrance Day next week, Lost Women of Science is telling the story of Margarethe Hilferding, a pioneering psychoanalyst and physician from Vienna who was murder… [+38126 chars]",2025-01-23T21:00:00Z,Scientific American,https://www.scientificamerican.com/article/margarethe-hilferding-the-first-woman-admitted-to-freuds-vienna-psychoanalytic-society/
"The Best Greens Powders, Tested and Reviewed (2025)","We did the research (and taste-testing) for you to determine whether greens powders are worth your money, and if so, which ones.","The health supplement market is both booming and, as far as the FDA is concerned, unregulated. I took a deep dive into the world of greens powders, speaking with dietitians and trying popular brands … [+4512 chars]",2025-02-05T12:39:00Z,Wired,https://www.wired.com/gallery/best-greens-powders/
"People With ADHD Are Living Shorter Lives, Study Finds",Diagnosed ADHD has been associated with reduced life expectancy for both men and women.,"As if having attention deficit hyperactivity disorder isn’t bad enough: New research this week suggests that people with ADHD are living shorter lives than expected.
Scientists at University College… [+3369 chars]",2025-01-25T15:00:41Z,Gizmodo.com,https://gizmodo.com/people-with-adhd-are-living-shorter-lives-study-finds-2000554087
Say Bye to Just BMI: Experts Call for a Major Shift in How We Measure Obesity,"An international and widely supported group of experts is pushing doctors to avoid the exclusive use of BMI to decide whether someone has obesity, alongside other major changes.","Traditional conceptions of obesity might be in for a radical shift. In a new report published this week, a widely-supported group of scientists is pushing for substantial changes in how obesity is di… [+6189 chars]",2025-01-14T23:30:58Z,Gizmodo.com,https://gizmodo.com/say-bye-to-just-bmi-experts-call-for-a-major-shift-in-how-we-measure-obesity-2000549992
The True Story Behind An Update on Our Family and the YouTubers Who Gave Up an Adopted Child,"A new HBO docuseries tells the story of the Stauffers, a family of YouTubers who rehomed an adopted child with special needs.","On May 26, 2020, Ohio-based vloggers Myka and James Stauffer uploaded a new video to YouTube titled An Update On Our Family. In the video, the couple responded to intensifying questions from their su… [+11494 chars]",2025-01-15T18:13:59Z,Time,https://time.com/7206477/an-update-on-our-family-true-story-stauffer-family/
